{
  "contract": "agentgov.semantic-review-provider-capabilities",
  "schema_version": "1.0",
  "provider_id": "fixture.generic-ide-independent-review",
  "adapter_id": "fixture.generic-ide",
  "source": {
    "owner": "organization",
    "access_mode": "organization_gateway"
  },
  "availability": {
    "status": "available",
    "reason_code": "organization_gateway_ready"
  },
  "review_mode": "independent_review",
  "independence_level": "different_provider",
  "cost_owner": "organization",
  "data_policy": {
    "retention": "provider_policy",
    "external_transfer": true
  },
  "content_boundary": {
    "contains_raw_prompt": false,
    "contains_raw_answer": false,
    "contains_transcript": false,
    "contains_assistant_response": false,
    "contains_source_content": false,
    "contains_credentials": false,
    "contains_model_prompt": false,
    "contains_absolute_paths": false
  },
  "authority_boundary": {
    "changes_requirements": false,
    "changes_architecture": false,
    "admits_task": false,
    "starts_session": false,
    "authorizes_code_change": false,
    "authorizes_scope_expansion": false,
    "authorizes_exception": false,
    "authorizes_git_operations": false,
    "authorizes_publication": false,
    "authorizes_release": false,
    "authorizes_deployment": false,
    "authorizes_external_write": false
  }
}
