{
  "contract": "agentgov.semantic-review-provider-capabilities",
  "schema_version": "1.0",
  "provider_id": "fixture.codex-self-review",
  "adapter_id": "fixture.codex",
  "source": {
    "owner": "active_host",
    "access_mode": "current_agent_entitlement"
  },
  "availability": {
    "status": "available",
    "reason_code": "active_session"
  },
  "review_mode": "self_review",
  "independence_level": "separate_pass",
  "cost_owner": "existing_user_entitlement",
  "data_policy": {
    "retention": "host_policy",
    "external_transfer": true
  },
  "content_boundary": {
    "contains_raw_prompt": false,
    "contains_raw_answer": false,
    "contains_transcript": false,
    "contains_assistant_response": false,
    "contains_source_content": false,
    "contains_credentials": false,
    "contains_model_prompt": false,
    "contains_absolute_paths": false
  },
  "authority_boundary": {
    "changes_requirements": false,
    "changes_architecture": false,
    "admits_task": false,
    "starts_session": false,
    "authorizes_code_change": false,
    "authorizes_scope_expansion": false,
    "authorizes_exception": false,
    "authorizes_git_operations": false,
    "authorizes_publication": false,
    "authorizes_release": false,
    "authorizes_deployment": false,
    "authorizes_external_write": false
  }
}
